{
    "$schema": "../../../src/open_yoku_rando/files/schema.json",
    "configuration_identifier": "starting-items",
    "save": {
        "seed": 4294967295
    },
    "pickups": [
        {
            "location": "intro_landing_upper:5394",
            "item": "mushroom_2",
            "caption": "Juicy Cove Mushroom: mushroom_2"
        },
        {
            "location": "intro_landing_upper:5605",
            "item": "mushroom_3",
            "caption": "Poison Toadstool: mushroom_3"
        },
        {
            "location": "hub_village:4686",
            "item": "toolbox",
            "caption": "Toolbox: toolbox"
        },
        {
            "location": "peak_guano_grief:669",
            "item": "guano",
            "caption": "Guano: guano"
        },
        {
            "location": "peak_beanstalk_base:2308",
            "item": "seed_pod",
            "caption": "Seed Pod: seed_pod"
        },
        {
            "location": "spring_shoddy_shanty:5433",
            "item": "skins/skin_3",
            "caption": "Underwater Puzzle: skins/skin_3"
        },
        {
            "location": "hub_island_express:3692",
            "item": "wallet",
            "caption": "Tower's Peak Crystal: wallet"
        },
        {
            "location": "hub_village:4661",
            "item": "abilities/speed",
            "caption": "Post Office Attic: abilities/speed"
        },
        {
            "location": "cave_temple_terror_lower:144",
            "item": "bluekey",
            "caption": "Key: Blue: bluekey"
        },
        {
            "location": "cave_temple_terror_lower:4978",
            "item": "greenkey",
            "caption": "Key: Green: greenkey"
        },
        {
            "location": "peak_filthy_flat:255",
            "item": "dustbunny_dirty",
            "caption": "Sootling 1: dustbunny_dirty"
        },
        {
            "location": "peak_filthy_flat:309",
            "item": "dustbunny_dirty",
            "caption": "Sootling 2: dustbunny_dirty"
        },
        {
            "location": "peak_filthy_flat:627",
            "item": "dustbunny_dirty",
            "caption": "Sootling 3: dustbunny_dirty"
        },
        {
            "location": "peak_filthy_flat:751",
            "item": "dustbunny_dirty",
            "caption": "Sootling 4: dustbunny_dirty"
        },
        {
            "location": "peak_filthy_flat:1300",
            "item": "dustbunny_dirty",
            "caption": "Sootling 5: dustbunny_dirty"
        },
        {
            "location": "peak_filthy_flat:264",
            "item": "dustbunny_dirty",
            "caption": "Sootling 6: dustbunny_dirty"
        },
        {
            "location": "spring_bubbly_basin:1241",
            "item": "tadpole",
            "caption": "Tadpole 1: tadpole"
        },
        {
            "location": "spring_bubbly_basin:1238",
            "item": "tadpole",
            "caption": "Tadpole 2: tadpole"
        },
        {
            "location": "spring_bubbly_basin:1244",
            "item": "tadpole",
            "caption": "Tadpole 3: tadpole"
        },
        {
            "location": "spring_bubbly_basin:1235",
            "item": "tadpole",
            "caption": "Tadpole 4: tadpole"
        },
        {
            "location": "spring_bubbly_basin:1229",
            "item": "tadpole",
            "caption": "Tadpole 5: tadpole"
        },
        {
            "location": "spring_bubbly_basin:1226",
            "item": "tadpole",
            "caption": "Tadpole 6: tadpole"
        },
        {
            "location": "spring_bubbly_basin:1041",
            "item": "tadpole",
            "caption": "Tadpole 7: tadpole"
        },
        {
            "location": "spring_bubbly_basin:1232",
            "item": "tadpole",
            "caption": "Tadpole 8: tadpole"
        },
        {
            "location": "hub_festival_upper:491",
            "item": "spores_2",
            "caption": "Mulch Pit: Village: spores_2"
        },
        {
            "location": "jungle_slug_struggle:3665",
            "item": "spores_3",
            "caption": "Mulch Pit: Ape: spores_3"
        },
        {
            "location": "cave_east_bay_shore:804",
            "item": "spores_4",
            "caption": "Mulch Pit: Beach: spores_4"
        },
        {
            "location": "peak_guano_grief:2514",
            "item": "spores_5",
            "caption": "Mulch Pit: Ivory: spores_5"
        },
        {
            "location": "jungle_willy:1219",
            "item": "idol1",
            "caption": "Statue Piece: Waterfall: idol1"
        },
        {
            "location": "cave_temple_terror_lower:4744",
            "item": "idol2",
            "caption": "Statue Piece: Underdark: idol2"
        },
        {
            "location": "peak_aerial_ascent:4033",
            "item": "idol3",
            "caption": "Statue Piece: Ivory: idol3"
        },
        {
            "location": "hub_obtainium_outland:234",
            "item": "idol4",
            "caption": "Statue Piece: Obt. Isles: idol4"
        },
        {
            "location": "peak_crystal_crater:2429",
            "item": "nugget",
            "caption": "Nugget 1: nugget"
        },
        {
            "location": "peak_crystal_crater:2238",
            "item": "nugget",
            "caption": "Nugget 2: nugget"
        },
        {
            "location": "peak_crystal_crater:2427",
            "item": "nugget",
            "caption": "Nugget 3: nugget"
        },
        {
            "location": "peak_crystal_crater:2425",
            "item": "nugget",
            "caption": "Nugget 4: nugget"
        },
        {
            "location": "intro_landing_upper:5733",
            "item": "abilities/partyhorn",
            "caption": "Chest: Noisemaker: abilities/partyhorn"
        },
        {
            "location": "intro_landing_right:5065",
            "item": "wallet",
            "caption": "Chest: Tweepers: wallet"
        },
        {
            "location": "hub_island_express:3644",
            "item": "wallet",
            "caption": "Chest: Tower: wallet"
        },
        {
            "location": "jungle_misty_meadow:2378",
            "item": "abilities/slug_vaccum",
            "caption": "Chest: Shed: abilities/slug_vaccum"
        },
        {
            "location": "spring_hidden_hotspring:2343",
            "item": "skins/skin_1",
            "caption": "Chest: Crystal Skull: skins/skin_1"
        },
        {
            "location": "cave_east_bay_shore:780",
            "item": "wallet",
            "caption": "Chest: Beach: wallet"
        },
        {
            "location": "spring_sleek_slabs:4542",
            "item": "wallet",
            "caption": "Chest: Church: wallet"
        },
        {
            "location": "peak_filthy_flat:2813",
            "item": "sootling_leash",
            "caption": "Chest: Leash: sootling_leash"
        },
        {
            "location": "hub_left_lofty_logo:498",
            "item": "powerups/skvader_1",
            "caption": "Chest: Treek: powerups/skvader_1"
        },
        {
            "location": "peak_beanstalk_base:3399",
            "item": "wallet",
            "caption": "Chest: Town Skip: wallet"
        },
        {
            "location": "peak_beanstalk_base:3390",
            "item": "tracker_peak",
            "caption": "Chest: Lava: tracker_peak"
        },
        {
            "location": "spring_cloudburst_cliffs:4925",
            "item": "powerups/skvader_2",
            "caption": "Chest: Waterfall: powerups/skvader_2"
        },
        {
            "location": "intro_muddled_morass:768",
            "item": "wallet",
            "caption": "Chest: Fosfor Cave Left: wallet"
        },
        {
            "location": "hub_cliffside_creek:497",
            "item": "skins/skin_5",
            "caption": "Chest: Fleek: skins/skin_5"
        },
        {
            "location": "cave_beaver_blockade:4699",
            "item": "tracker_caves",
            "caption": "Chest: Screech: tracker_caves"
        },
        {
            "location": "hub_village:4502",
            "item": "abilities/dive_speed",
            "caption": "Chest: Willo: abilities/dive_speed"
        },
        {
            "location": "intro_landing:6175",
            "item": "reward_fruit_medium",
            "caption": "Mailbox 01: Hairy: reward_fruit_medium"
        },
        {
            "location": "intro_muddled_morass:99",
            "item": "reward_fruit_medium",
            "caption": "Mailbox 02: Fosfor: reward_fruit_medium"
        },
        {
            "location": "intro_landing_upper:5673",
            "item": "reward_fruit_medium",
            "caption": "Mailbox 03: Baldino: reward_fruit_medium"
        },
        {
            "location": "intro_landing_right:4793",
            "item": "tracker_scarabs",
            "caption": "Mailbox 04: Tweepers: tracker_scarabs"
        },
        {
            "location": "hub_cliffside_creek:467",
            "item": "reward_fruit_medium",
            "caption": "Mailbox 05: Fleek: reward_fruit_medium"
        },
        {
            "location": "intro_landing_right:4798",
            "item": "reward_fruit_medium",
            "caption": "Mailbox 06: Screech: reward_fruit_medium"
        },
        {
            "location": "jungle_slug_struggle:3349",
            "item": "reward_fruit_medium",
            "caption": "Mailbox 07: Ape: reward_fruit_medium"
        },
        {
            "location": "jungle_mollusc_madness:3814",
            "item": "reward_fruit_medium",
            "caption": "Mailbox 08: Slug Gardener: reward_fruit_medium"
        },
        {
            "location": "jungle_misty_meadow:1967",
            "item": "reward_fruit_medium",
            "caption": "Mailbox 09: Shed: reward_fruit_medium"
        },
        {